{
  "request_id": "appr_req_20260910_192925_a29153",
  "post_id": "post_approval_test",
  "requested_at": "2026-09-10T19:29:25.660788+00:00",
  "action_scope": "METRICOOL_SCHEDULE",
  "target_platform": "linkedin",
  "proposed_schedule_time": "2026-09-11T19:29:25.660763+00:00",
  "canonical_payload_sha256": "b816151f20fbe18bcbb1ffc54d4107c6d01b3bfb982d9d54030a02fd19a1cb36",
  "content_summary": "DMA Buffer Contention Optimization",
  "content_full_text": "Verifiable content explaining bus arbitration on Cortex-M7.",
  "media_asset_hashes": [
    "aabbccddeeff00112233445566778899aabbccddeeff00112233445566778899"
  ],
  "scorecard_summary": {
    "composite_score": 89.0,
    "slop_detected": false,
    "grounding_percentage": 100.0
  }
}